[
	{
		"id": "evt_0001",
		"youtube_id": "aqz-KE-bpKQ",
		"title": "[SAMPLE] Gathering at Patel Chowk — morning",
		"channel": "Sample Citizen Upload",
		"published_at": "2026-07-20T09:14:00Z",
		"date_claimed": "2026-07-20",
		"location_claimed": "Patel Chowk, New Delhi",
		"theme": ["assembly", "march"],
		"source_type": "citizen",
		"verification_status": "unverified",
		"verification_notes": "SAMPLE DATA — placeholder clip, not curated footage. Replace via the curation workflow.",
		"graphic_content": false,
		"reposted_from": null,
		"added_by": "seed",
		"added_at": "2026-07-21T14:30:00Z"
	},
	{
		"id": "evt_0002",
		"youtube_id": "eRsGyueVLvQ",
		"title": "[SAMPLE] Police cordon near Jantar Mantar",
		"channel": "Sample News Desk",
		"published_at": "2026-07-20T13:02:00Z",
		"date_claimed": "2026-07-20",
		"location_claimed": "Jantar Mantar, New Delhi",
		"theme": ["police-action"],
		"source_type": "mainstream-media",
		"verification_status": "confirmed",
		"verification_notes": "SAMPLE DATA — placeholder clip. Status shown to exercise the badge system only.",
		"graphic_content": false,
		"reposted_from": null,
		"added_by": "seed",
		"added_at": "2026-07-21T14:31:00Z"
	},
	{
		"id": "evt_0003",
		"youtube_id": "R6MlUcmOul8",
		"title": "[SAMPLE] Party channel statement re: gathering",
		"channel": "Sample Party Channel",
		"published_at": "2026-07-20T18:40:00Z",
		"date_claimed": "2026-07-20",
		"location_claimed": "New Delhi",
		"theme": ["statement"],
		"source_type": "party-channel",
		"verification_status": "reported",
		"verification_notes": "SAMPLE DATA — placeholder clip. 'reported' = claim awaiting independent cross-check.",
		"graphic_content": false,
		"reposted_from": null,
		"added_by": "seed",
		"added_at": "2026-07-21T14:32:00Z"
	},
	{
		"id": "evt_0004",
		"youtube_id": "WhWc3b3KhnY",
		"title": "[SAMPLE] Clip circulating as CJP footage (older event)",
		"channel": "Sample Reupload",
		"published_at": "2026-07-19T21:15:00Z",
		"date_claimed": "2026-07-20",
		"location_claimed": "unknown",
		"theme": ["misattributed"],
		"source_type": "citizen",
		"verification_status": "recycled-footage",
		"verification_notes": "SAMPLE DATA — placeholder clip. 'recycled-footage' = reverse-image search matched an earlier, unrelated event.",
		"graphic_content": false,
		"reposted_from": null,
		"added_by": "seed",
		"added_at": "2026-07-21T14:33:00Z"
	},
	{
		"id": "evt_0005",
		"youtube_id": "Y-rmzh0PI3c",
		"title": "[SAMPLE] Speeches at the main stage",
		"channel": "Sample Citizen Upload",
		"published_at": "2026-07-20T16:05:00Z",
		"date_claimed": "2026-07-20",
		"location_claimed": "Ramlila Maidan, New Delhi",
		"theme": ["speeches", "assembly"],
		"source_type": "citizen",
		"verification_status": "confirmed",
		"verification_notes": "SAMPLE DATA — placeholder clip.",
		"graphic_content": false,
		"reposted_from": null,
		"added_by": "seed",
		"added_at": "2026-07-21T14:34:00Z"
	},
	{
		"id": "evt_0006",
		"youtube_id": "jNQXAC9IVRw",
		"title": "[SAMPLE] Short phone clip, unclear location",
		"channel": "Sample Citizen Upload",
		"published_at": "2026-07-20T11:48:00Z",
		"date_claimed": "2026-07-20",
		"location_claimed": "New Delhi (unconfirmed)",
		"theme": ["crowd"],
		"source_type": "citizen",
		"verification_status": "unverified",
		"verification_notes": "SAMPLE DATA — placeholder clip.",
		"graphic_content": true,
		"reposted_from": null,
		"added_by": "seed",
		"added_at": "2026-07-21T14:35:00Z"
	}
]
